title,ingredients
Point reyes bleu and nectarine bruschetta,"1 baguette,1/2 cup olive oil,Kosher salt and freshly ground black pepper,3 nectarines,1 cup bleu cheese dip (recommended: Point Reyes Bleu Cheese Dip),12 (8-inch) bamboo skewers, soaked in water 30 minutes"
Chai coconut tea,"3 tea bags black tea,2 tablespoons coconut chips,2 tablespoons ginger flakes,8 cloves,5 green cardamom pods,1 cinnamon stick, roughly chopped,1/2 leftover, empty vanilla bean, finely chopped"
Chicken in romanesco sauce,"2 red bell peppers (or 1 red and 1 yellow),1/2 cup Marcona almonds or blanched raw almonds,1/2 cup chicken stock,1/2 cup fresh flat-leaf parsley leaves,Zest and juice of 1 lemon,Zest and juice of 1 orange,2 large cloves garlic, crushed,1 Fresno chile pepper,1/2 red onion, coarsely chopped,1 large heirloom tomato,2 tablespoons EVOO,8 bone-in chicken thighs,1 teaspoon smoked sweet paprika,Salt and freshly ground pepper,1/2 cup dry sherry"
Mini chicken potpies,"1 3/4 pounds skin-on, bone-in chicken thighs (about 6),Kosher salt and freshly ground pepper,2 tablespoons extra-virgin olive oil,2 leeks (white and light green parts only), sliced 1/4 inch thick,1 fennel bulb, cored and thinly sliced, plus 1 tablespoon chopped fronds,1 tablespoon all-purpose flour, plus more for dusting,1/4 cup Pernod or white wine,Pinch of saffron (optional),1 cup heavy cream,1/2 teaspoon finely grated orange zest,2 medium red-skinned potatoes (about 1/2 pound), diced,3 small plum tomatoes, finely chopped,1 17-ounce box frozen puff pastry, thawed,1 large egg, lightly beaten"
Gratin potatoes,"1 pound russet potatoes, scrubbed clean,1 clove garlic, smashed,3/4 cup heavy cream,Few grates whole nutmeg,1/4 cup grated Parmesan,Salt and pepper"
Grilled rib eye with tomato and poblano chile sauce,"2 large poblano chiles (about 5 ounces each),1 tablespoon dried Mexican oregano,1/4 teaspoon fennel seeds,1/8 teaspoon dried crushed red pepper,2 tablespoons extra-virgin olive oil,2 cloves garlic, finely chopped,1 cup canned crushed tomatoes,1/4 cup beef broth,1 tablespoon tomato paste,Kosher salt and freshly ground black pepper,1 tablespoon cornstarch,2 1/2 teaspoons kosher salt,1 1/4 teaspoons freshly ground black pepper,Four 8-ounce rib eye steaks (each about 1-inch thick),Vegetable oil, for brushing"
Pinot grigio poached pears,"4 ripe Anjou or Bosc pears,3 1/2 cups Pinot Grigio,3/4 cup sugar,1/4 teaspoon anise seed,1 long strip of lemon peel,1/2 cup mascarpone cheese,Dulce de leche, for serving,4 small anise tortas or thin, sweet crackers"
Grilled guacamole,"3 avocados, halved and pitted,2 large jalapenos, halved and seeded,2 medium cloves garlic, ground into a paste with kosher salt or grated,1 small red onion, finely chopped,Juice of 1 lemon,Juice of 1 lime,Salt"
Lobster and shells,"Kosher salt,Good olive oil,1 pound small pasta shells, such as Ronzoni,Kernels from 8 ears of corn (about 6 cups),12 scallions, white and green parts, thinly sliced,2 yellow or orange bell peppers, seeded and small-diced,2 pints cherry tomatoes, halved,2 pounds cooked fresh lobster meat, medium-diced,1 1/2 cups good mayonnaise,1 cup sour cream,1/2 cup freshly squeezed lemon juice (4 lemons),Freshly ground black pepper,1 1/2 cups minced fresh dill"
Rum-raisin rice pudding,"1/2 cup golden raisins,1/4 cup dark rum,2 3/4 cups whole milk,1 cup long-grain white rice,1/2 cup firmly packed light brown sugar,1/2 cup granulated sugar,2 tablespoons unsalted butter,1 teaspoon salt,1/4 teaspoon ground cinnamon,1 cup half-and-half, plus 1/2 cup,1 tablespoon cornstarch,3 large egg yolks, lightly beaten,1 1/2 teaspoons vanilla extract"
Turkey mole,"6 to 8 turkey thighs (3/4 pound each),1/2 large white onion,2 stalks celery, quartered,1 large bunch cilantro (about 1 cup sprigs),2 whole cloves,4 allspice berries,1/4 star anise pod (break off a point),5 black peppercorns,Kosher salt,4 medium tomatillos, husked,2 medium tomatoes,4 cloves garlic, unpeeled,1/2 large white onion,3/4 cup vegetable oil or lard,8 dried ancho chiles, stemmed and seeded (seeds reserved),8 dried pasilla chiles, stemmed and seeded,1 corn tortilla, plus more for serving (optional),1/2 cup raw almonds, chopped,1/2 cup raisins,1/2 cup pepitas (hulled pumpkin seeds),4 tablespoons sesame seeds, plus more for topping,5 allspice berries,5 black peppercorns,2 whole cloves,Kosher salt,6 ounces sweet Mexican drinking chocolate, chopped,Cooked rice, for serving,1/4 star anise pod (break off a point),1 1-inch piece cinnamon stick"
"Portobello mushroom, hot and sweet pepper ragu with pappardelle","2 Italian red cherry peppers or 2 large Fresno chile peppers,1 large or 2 medium red bell peppers,1/4 cup EVOO,1/4 pound pancetta or guanciale, chopped into batons,4 to 5 portobello mushroom caps, gills scraped, sliced,3 tablespoons finely chopped fresh rosemary,2 tablespoons thinly sliced fresh sage,1 tablespoon finely chopped fresh thyme,1/2 tablespoon fresh marjoram or oregano, or 1 teaspoon dried,4 large cloves garlic, sliced,1 large or 2 medium onions, chopped,Salt and freshly ground black pepper,2 tablespoons tomato paste,1 1/2 cups dry red wine,One 32-ounce can whole D.O.P. San Marzano tomatoes,1 pound pappardelle,Pecorino cheese, grated, for serving"
Creamed spinach,"1 pound fresh organic spinach, soaked several times in salt water to remove grit, well-rinsed and dried in a salad spinner,4 ounces bacon (about 4 strips),1/2 cup heavy cream,1/4 cup Parmesan,Salt and pepper,Freshly ground black pepper"
Pork loin with mushroom fricassee,"2 tablespoons minced shallots,1 tablespoon minced garlic,1 tablespoon minced fresh thyme leaves,1 teaspoon minced fresh oregano leaves,1 teaspoon minced parsley leaves,1 (5-pound) pork loin,Paste, recipe follows,1 cup chicken stock,Mushroom Fricassee, recipe follows,1 cup brown sugar,2 teaspoons finely chopped garlic,2 teaspoons ground ginger,1/2 teaspoon ground cloves,1/4 teaspoon ground black pepper,1 teaspoon kosher salt,4 tablespoons (1/2 stick) butter,1/2 cup thinly sliced morel or chanterelle mushrooms,1/2 cup thinly sliced shiitake mushrooms,1/2 cup thinly sliced portobello mushrooms,1/2 cup thinly sliced domestic mushrooms,1/4 cup tomato paste,Pinch ground cinnamon,Pinch ground nutmeg,Pinch ground cloves,Salt and pepper"
Pumpkin-cranberry cheesecake,"1 7-ounce package amaretti cookies,1 tablespoon sugar,6 tablespoons unsalted butter, melted, plus more for the pan,For the filling:,1 pound whole-milk ricotta cheese (preferably fresh)1 1/2 cups sugar,1 15-ounce can pure pumpkin puree,3 large eggs,3/4 cup mascarpone cheese,1 tablespoon pure vanilla extract,1 1/2 teaspoons pumpkin pie spice,1/2 teaspoon salt,For the topping:,1 3/4 cups fresh cranberries,1/2 cup sugar,1 tablespoon fresh lemon juice,Pinch of salt"
Stout and caramel milkshakes,"1 cup heavy whipping cream,3 cups caramel ice cream,12 ounces stout beer,2 tablespoons malt powder"
Asparagus-wild mushroom risotto with parmesan,"2 teaspoons olive oil,2 shallots, chopped,2 cloves garlic, minced (or 2 teaspoons pre-minced garlic),8 cups sliced wild mushrooms (any combination of shiitake, cremini, oyster, etc).,1 teaspoon dried thyme,2 cups cooked Arborio rice,1 cup reduced-sodium beef broth,2 cups chopped fresh or frozen asparagus spears (1-inch pieces),1/2 cup grated Parmesan,2 tablespoons chopped fresh parsley leaves,Salt and ground black pepper"
Fresh ginger fruit salad,"1 tablespoon minced ginger,Juice of 1 orange,Juice of 1 lime,1 large mango, peeled and diced,1 small pineapple, peeled and diced,2 large Asian pears, peeled and diced,1 pint raspberries"
Vanilla-almond panna cotta,"1 cup almond milk, divided,1 (1/4-ounce) package unflavored gelatin,1 1/2 cups heavy cream,1/2 cup sugar,1/2 teaspoon plus 1/4 teaspoon almond extract,1 teaspoon vanilla extract,1/4 cup chocolate fudge syrup, for garnish"
Roasted italian cauliflower,"1 small head cauliflower, cut into medium-size florets (about 4 cups),1/2 cup grape tomatoes, halved,3 tablespoons extra-virgin olive oil,1 tablespoon drained capers,Kosher salt and freshly ground black pepper,2 cloves garlic, thinly sliced,1/4 lemon,2 tablespoons chopped fresh parsley"
Lettuce cups with tofu and beef,"1 tablespoons bottled chili-garlic sauce,1 1/2 teaspoons toasted sesame oil,3 tablespoons low-sodium soy sauce,1/4 cup hoisin sauce,2 tablespoons rice vinegar,2 tablespoons sherry or Chinese cooking wine,8 ounces extra-firm tofu,2 teaspoons canola oil,2 tablespoons fresh minced ginger,4 scallions, greens trimmed and reserved, thinly sliced (about 1/3 cup each greens and whites - 3/4-ounce each),1/2 pound lean ground beef (90 percent or leaner),1/2 cup finely diced water chestnuts,1 large head Bibb lettuce, outer leaves discarded, leaves separated,1 red bell pepper, finely diced,1/4 cup chopped peanuts"
Pear ginger crumble,"1/4 cup oat flour or whole wheat flour,2/3 cup old-fashioned oats,1/2 cup packed light brown sugar,1 teaspoon ground cinnamon,1/8 teaspoon salt,1/4 cup canola oil,3 pounds firm but ripe pears, peeled, cored and cut into 1/4-inch slices,1 tablespoon fresh lemon juice,1 tablespoon freshly grated ginger,2 tablespoons sugar,1 1/2 tablespoons all-purpose flour,1 1/2 cups reduced-fat vanilla ice cream or frozen vanilla yogurt, optional"
Mexican lasagna,"3 tablespoons extra-virgin olive oil,2 pounds ground chicken breast, available in the packaged meats case,2 tablespoons chili powder,2 teaspoons ground cumin,1/2 red onion, chopped,1 (15-ounce) can black beans, drained,1 cup medium heat taco sauce or 1 (14-oz) can stewed or fire roasted tomatoes,1 cup frozen corn kernels,Salt,8 (8 inch) spinach flour tortillas, available on dairy aisle of market,2 1/2 cups shredded Cheddar or shredded pepper jack,2 scallions, finely chopped"
Spanish tortilla,"1 1/2 pounds russet potatoes, peeled and thinly sliced,2 tablespoons olive oil,1/2 large sweet onion, thinly sliced,Kosher salt and freshly cracked black pepper,1/4 pound dry Spanish chorizo or salami, sliced,2 cloves garlic, minced,6 eggs,2/3 cup milk,3 green onions, chopped,1 cup shredded Cheddar"
Italian grilled cheese-n-tomato,"1/2 cup extra-virgin olive oil,1 large clove garlic, cracked away from skin,8 slices crusty Italian bread,1 pound smoked fresh mozzarella cheese, sliced,2 ripe tomatoes, thinly sliced,8 basil leaves, torn"
Apple tart tatin,"1 stick butter, cut into pea size pieces,1 cup all-purpose flour, plus extra for rolling,1/4 cup sugar,Pinch salt,1 lemon, zested,1 egg yolk,2 to 3 tablespoons ice water,1 cup sugar,1/4 cup apple cider,1/2 lemon, juiced,1 vanilla bean, seeds scraped,1 stick butter, cut into pats,6 apples, such as Golden Delicious, Granny Smith, McIntosh or your favorite baking apple, peeled, cored and quartered,Mascarpone cheese mixed with 2 tablespoon sugar, for garnish"
Pork carnitas,"2 pounds boneless pork shoulder (or 2 1/2 pounds bone-in),Salt and freshly ground black pepper,2 teaspoons dried oregano,1 teaspoon ground cumin,1 tablespoon olive oil,1 onion, coarsely chopped,4 cloves garlic, minced,1 jalapeno, seeded and ribs removed, chopped,1 orange, cut in half,3 tablespoons vegetable oil"
"Roasted lamb chops with shallots, tomatoes, and olive jus","4 garlic cloves,1 1/2 teaspoons salt,4 tablespoons chopped fresh rosemary leaves,1 teaspoon freshly ground black pepper,5 tablespoons olive oil,4 (1 1/4-inch-thick) lamb chops (12 to 14 ounces each), frenched, if desired,8 large shallots,8 plum tomatoes,1 tablespoon minced fresh thyme,1 tablespoon minced garlic,1/4 teaspoon sugar,1/2 cup drained Nicoise olives,1 cup dry white wine,1 cup chicken broth,1 tablespoon unsalted butter,2 to 3 tablespoons minced parsley"
Tequila chorizo clams on the grill,"6 ounces raw chorizo, removed from casings,2 tablespoons unsalted butter,1 small white onion, chopped,3 garlic cloves, finely minced,1 cup tequila anejo,3/4 cup bottled clam juice,2 pounds littleneck clams, scrubbed and rinsed,1 tablespoon chopped fresh cilantro,1 loaf sourdough bread, for serving"
Greek sorghum bowl,"1 1/2 cups cooked whole-grain sorghum,1/2 sweet onion,2 teaspoons olive oil,1/4 cup pine nuts,Salt,1/2 cup cherry or grape tomatoes, sliced in half,1/2 cup cucumbers, chopped into small cubes,1/4 cup feta cheese, crumbled,10 kalamata olives, halved"
White chicken chili,"2 tablespoons extra-virgin olive oil,1 onion, chopped,3 cloves garlic, chopped,2 jalapeno peppers (1 diced, 1 halved; remove seeds for less heat),1 poblano chile pepper, seeded and chopped,1 tablespoon ground cumin,1 teaspoon ground coriander,1/2 teaspoon dried oregano,1/4 teaspoon ground allspice,2 pounds ground chicken,Kosher salt and freshly ground pepper,2 15-ounce cans white navy beans (do not drain),1 4-ounce can chopped green chiles (do not drain),2 cups low-sodium chicken broth,3 corn tortillas, torn, plus more for serving,1 bunch cilantro, leaves roughly chopped,Shredded cheddar cheese, sour cream and pickled jalapenos, for topping,Lime wedges, for serving"
Balsamic glazed grilled plums with vanilla ice cream,"4 ripe plums, California red or dark skinned, halved and pitted,Extra-virgin olive oi , for drizzling,1/2 cup balsamic vinegar,1 tablespoon brown sugar,1 teaspoon vanilla extract,1 tablespoon lemon juice,1/4 teaspoon ground black pepper,1 pint vanilla bean ice cream"
Mini scalloped potatoes,"Unsalted butter, softened, for the ramekins,1 1/4 cups grated sharp white cheddar cheese,1/2 cup grated parmesan cheese,1 tablespoon finely chopped fresh chives,1/4 teaspoon all-purpose flour,Large pinch of cayenne pepper,1 1/2 pounds Yukon Gold potatoes (1 1/2 to 2 inches in diameter), unpeeled,Kosher salt and freshly ground black pepper,1 cup plus 2 tablespoons heavy cream"
Cuban picadillo,"2 tablespoons olive oil,1 large yellow onion, finely chopped (about 2 cups),4 cloves garlic, minced,2 bay leaves,1 pound ground beef or combination of beef chorizo, and pork,1/3 cup dry white wine or dry sherry,10 cherry tomatoes, chopped or 1 (8-ounce) can diced tomatoes with juice,1/3 cup tomato paste,1/3 cup chopped pimento stuffed Spanish olives with 1 tablespoon brine from jar,1/3 cup raisins,2 teaspoons dried oregano,2 teaspoons ground cumin,1/4 teaspoon cayenne pepper, optional,Salt and freshly ground black pepper"
Spiced bar nuts with orange bitters,"Nonstick cooking spray,2 tablespoons honey,2 tablespoons light brown sugar,1 tablespoon ground garam masala,2 teaspoons red chile flakes,1 teaspoon fennel seeds,1 tablespoon orange bitters,1 tablespoon kosher salt,4 cups mixed unsalted raw nuts (cashews, walnuts, pecans and almonds, or whatever your favorite nuts are),Fleur de sel, for finishing"
Roasted fingerling potatoes with fresh herbs and garlic,"2 pints fingerling potatoes,2 sprigs fresh rosemary,2 to 3 sprigs fresh sage,3 sprigs fresh thyme,6 cloves garlic, left unpeeled,3 tablespoons extra-virgin olive oil, plus for sheet pan,Salt and pepper"
Butterflied chicken greek style,"1 (3-pound) chicken, washed, patted dry and butterflied,Kosher salt and freshly ground black pepper,Canola oil,6 plum tomatoes, halved,3 lemons, cut in 1/2,1 red onion, skin on, cut into 1/2-inch thick rounds,1/4 cup red wine vinegar,2 tablespoons Dijon mustard,1/2 to 3/4 cup Greek olive oil,2 to 3 tablespoons chopped oregano leaves,1 English cucumbers, sliced,1/2 cup kalamata olives, pitted,6 ounces feta, crumbled,1/4 cup basil leaves,1/4 cup Greek whole milk yogurt"
Grilled white fish with chermoula,"Pinch saffron threads,1/4 cup hot water,1 tablespoon canola oil,3 cloves garlic, finely chopped,1 teaspoon ancho chile powder,1 teaspoon ground coriander,1 teaspoon ground cumin,1/2 teaspoon chile de arbol,1/4 cup extra-virgin olive oil,1 teaspoon finely grated lemon zest,Juice of 1 lemon,2 red bell peppers, grilled, peeled, seeded and sliced,2 ripe beefsteak tomatoes, diced and seeded,20 fresh mint leaves, torn,3 tablespoons coarsely chopped fresh cilantro,2 pound halibut fillet (1 1/2-to-2-inches thick),Canola oil,Kosher salt and freshly ground black pepper"
Pepperoni pizza soup,"2 1/2 cups prepared tomato-basil-garlic soup,1 1/2 cups water,2 cloves garlic, minced,1 1/2 cups elbow macaroni (or other short pasta such as ditalini or alphabets),2 green onions, sliced,2 teaspoons dried oregano, plus more for broiling,1/3 cup diced pepperoni,1 cup grated mozzarella,1 cup grated Cheddar"
Chorizo quesadillas,"4 large (12-inch) flour tortillas,2 cups shredded Monterey pepper Jack or smoked Cheddar,1/2 pound chorizo or andouille, casing removed and finely chopped,2 scallions, chopped,3 small plum tomatoes, seeded and chopped,1 jalapeno, seeded and finely chopped,1 small white onion, finely chopped,Handful cilantro, finely chopped,Coarse salt"
