main	starters & side dishes	desserts	cuisine	restaurant id	restaurant_id
GRILLED SHRIMP WITH GARLIC MAYO	TUSCAN SEAFOOD STEW		Seafood menu		restaurant_id_60
CRUNCHY SHRIMP	SHRIMP AND SALT COD RAVIOLI WITH YELLOW PEPPER ROMESCO SAUCE		Seafood menu		restaurant_id_60
SEAFOOD SALAD	FISH IN PARCHMENT WITH CITRUS REDUCTION		Seafood menu		restaurant_id_60
FLORIDA CITRUS GARDEN SALAD	STEAMED CLAMS WITH CHORIZO, CITRUS AND SAFFRON AIOLI		Seafood menu		restaurant_id_60
LOBSTER-AVOCADO COCKTAIL			Seafood menu		restaurant_id_61
MEXICAN AVOCADO SALSA			Seafood menu		restaurant_id_61
NACHO CHEESE CORN CHIP-ENCRUSTED MOZZARELLA STICKS	CHICKEN ENCHILADAS	GRILLED MANGO WITH LIME, SALT AND ANCHO POWDER	Tex-mex menu		restaurant_id_61
BBQ BAKED BEANS BRUSCHETTA WITH CILANTRO PESTO ON CHEESY TEXAS CUT TOAST	TEXAS VENISON CHILI	CINNAMON CHURROS WITH MEXICAN CHOCOLATE DIPPING SAUCE	Tex-mex menu		restaurant_id_61
GRILLED GREEN CHILI QUESADILLAS	BUTTERFLIED TURKEY WITH YUCATAN RUB	TEXAS FRENCH TOAST BANANAS FOSTER	Tex-mex menu		restaurant_id_61
PORK-SWEET POTATO QUESADILLAS	WHOLE SNAPPER WITH GRILLED VERA CRUZ SALSA	DESSERT NACHOS	Tex-mex menu		restaurant_id_61
CRISPY SQUASH BLOSSOMS FILLED WITH PULLED PORK AND RICOTTA	SMOKED TURKEY BAKED CHIMICHANGAS	MEXICAN CARAMEL SUNDAES	Tex-mex menu		restaurant_id_61
	POLLO ASADO	DULCE DE LECHE CHURRO TOTS WITH WHIPPED CREAM	Tex-mex menu		restaurant_id_62
MOLE-SPICED NUTS 	COWBOY STEAK WITH COFFEE AND CHILI RUB		Tex-mex menu		restaurant_id_62
TEQUILA LACED GAZPACHO COCKTAILS WITH GRILLED SHRIMP	BEEF EMPANADAS	TRES LECHES CAKE	Tex-mex menu		restaurant_id_63
PICO DE GALLO	GRILLED FISH TACOS WITH VERA CRUZ SALSA	LEMON BARS	Tex-mex menu		restaurant_id_63
CRISPY CORN FRITTERS WITH TOMATO SALAD	TEXAS STYLE PESTO WITH PORK TENDERLOIN AND SPANISH RICE	CHOCOLATE-BACON CUPCAKES WITH DULCE DE LECHE FROSTING	Tex-mex menu		restaurant_id_64
	TURKEY MOLE	NO RECIPE RECIPE: APPLES FOSTER	Tex-mex menu		restaurant_id_64
HICKORY SMOKED CHICKEN WINGS WITH JERK SAUCE AND LIME	TEX-MEX TURKEY BURGERS WITH AVOCADO MAYONNAISE	MINI SWEET POTATO PIES	Tex-mex menu		restaurant_id_65
SKILLET-FRIED CORN AND TOMATOES	BBQ RIBS WITH ROOT BEER BBQ SAUCE	MEXICAN CARAMEL SUNDAES	Tex-mex menu		restaurant_id_65
POPCORN SHRIMP WITH CHILI-LIME DIPPING SAUCE	BIRRIA TACOS	ICE CREAM SANDWICH	Tex-mex menu		restaurant_id_66
CHILLED CORN SOUP	GRILLED CORN SALAD WITH LIME, RED CHILI AND COTIJA	LOOPY LIME AND LYCHEE GELATIN PARFAIT	Tex-mex menu		restaurant_id_66
SOUTH AMERICAN PEANUT PORK	STUFFED RED BELL PEPPER RELLENOS	CRANBERRY GRANITA	Tex-mex menu		restaurant_id_67
SMOKED CHILE SCALLOPED SWEET POTATOES	PROSCIUTTO, FIG, AND GOAT CHEESE QUESADILLAS	PRICKLY PEAR SORBET	Tex-mex menu		restaurant_id_67
HOLIDAY HORSERADISH DEVILED EGGS	TURKEY POSOLE	PEANUTTY CHOCOLATE DIP WITH DIPPERS	Tex-mex menu		restaurant_id_68
TEQUILA CURED SALMON	HUEVOS RANCHEROS WITH BACON TORTILLAS	BOURBON-MAPLE-PECAN SUNDAE	Tex-mex menu		restaurant_id_68
TOMATO-TORTILLA SOUP	CASINO EL CAMINO - AMARILLO BURGER	MINI ICE CREAM SANDWICHES	Tex-mex menu		restaurant_id_69
YUCCA FRIES WITH MOJO MAYO	SOUTHWEST TURKEY BURGERS	WAFFLED BROWNIE SUNDAE	Tex-mex menu		restaurant_id_69
SPICY CABBAGE SALAD	CHICKEN PEPIAN	DARK CHOCOLATE SAMOA CUPCAKES	Tex-mex menu		restaurant_id_69
PRETZEL-CRUSTED FRIED CHEESE WITH SPICY RANCH	MEXICAN-STYLE CHICK-PEA SALAD	SORGHUM CARAMEL APPLES	Tex-mex menu		restaurant_id_70
RUMMY PINEAPPLE SALSA	CHICKEN IN GREEN PIPIAN SAUCE	EASY AND DELICIOUS PUMPKIN MOUSSE	Tex-mex menu		restaurant_id_70
	WILD GAME CHILI		Tex-mex menu		restaurant_id_70
SPICY POPCORN	CHICKEN IN GREEN CHILE SAUCE	CARAMEL APPLE PIE ON A STICK	Tex-mex menu		restaurant_id_71
GRILLED MUSHROOM SKEWERS	DIRTY RICE	SWEET POTATO PIE	Tex-mex menu		restaurant_id_71
SPICY FRIED MACARONI AND CHEESE BITES	CIDER BRINED GRILLED STUFFED PORK CHOPS	GRILLED PINEAPPLE WITH POUND CAKE AND RUM-CARAMEL SAUCE	Tex-mex menu		restaurant_id_71
GUACAMOLE WITH CUMIN DUSTED TORTILLAS	CARIBBEAN-STYLE BURGER WITH JERK KETCHUP AND BEER BATTERED ONIONS	CANDIED PRETZEL PARTS	Tex-mex menu		restaurant_id_72
GREEN ONION HASH BROWN POTATOES	STEAK AND CHEESE HOAGIES 	RUM CARAMEL CAKE	Tex-mex menu		restaurant_id_72
TACO POCKETS	PSYCHO TIBEY CHEESESTEAK 	BUTTERSCOTCH-PECAN BLONDIES	Tex-mex menu		restaurant_id_72
CHIPOTLE PORKY JOE SLIDERS	CASINO EL CAMINO - AMARILLO BURGER	SMORRITOS	Tex-mex menu		restaurant_id_73
MOLASSES BBQ BEANS	ASPARAGUS AND SWISS MACARONI AND CHEESE	BUTTERSCOTCH LOVE CAKE	Tex-mex menu		restaurant_id_73
DOUBLE-FRIED FRENCH FRIES	SUGARED SIRLOINS	MANGO-AGAVE GRANOLA WITH GREEK YOGURT	Tex-mex menu		restaurant_id_73
SPICY FRIED MACARONI AND CHEESE BITES	FRIED CHICKEN	BLUEBERRY ALMOND FRENCH TOAST BAKE	Tex-mex menu		restaurant_id_74
GRILLED HASSLEBACK SWEET POTATOES WITH MOLASSES-NUTMEG BUTTER	BROWN SUGAR SKIRT STEAK WITH SUCCOTASH	APPLE CINNAMON BLONDIES	Tex-mex menu		restaurant_id_74
STEAMED CLAMS WITH CHORIZO AND TEQUILA	SHORT RIB CHILI	RUM RAISIN TRUFFLES	Tex-mex menu		restaurant_id_74
PICKLED JALAPENOS	TURKEY CORN CHILI	MARBLEIZED BROWNIES	Tex-mex menu		restaurant_id_74
BBQ-GLAZED CHICKEN NUGGETS	BUFFALO CHICKEN MEATLOAF	SALTED BUTTERSCOTCH BLONDIES	Tex-mex menu		restaurant_id_75
ALL-AMERICAN POTATO SALAD	CHILI MAC	STICKY MONKEY BREAD	Tex-mex menu		restaurant_id_75
PARKER HOUSE ROLLS	FULLY LOADED BACON-WRAPPED HOT DOGS	CHOCOLATE CAKE IN A MUG	Tex-mex menu		restaurant_id_75
CHIPOTLE BBQ TURKEY MINI MEATLOAVES	CHRISTMAS-STYLE STACKED ENCHILADAS	HEAVENLY HASH BROWNIES	Tex-mex menu		restaurant_id_75
BEER- BRAISED BABY BACK RIBS	BRAISED LAMB TACOS	OATMEAL-FLAX CHOCOLATE CHIP COOKIES	Tex-mex menu		restaurant_id_76
BEER-B-Q RIBS FOR TWO	JERK TURKEY LEGS	CHOCOLATE CHIP QUINOA COOKIES	Tex-mex menu		restaurant_id_76
AIR FRIES WITH NACHO CHEESE	GRILLED CHICKEN MOLE	PEACHES AND CREAM OATMEAL COOKIES	Tex-mex menu		restaurant_id_76
KIDS CAN MAKE: SLOPPY JOE SLIDERS	TUNA TOSTADAS WITH CHILE MAYONNAISE	COOKIE DOUGH TRUFFLES	Tex-mex menu		restaurant_id_76
CHILI CHIPS	YUCATAN CHICKEN PUFFY TACOS WITH PEANUT-RED CHILI BBQ SAUCE AND RED CABBAGE SLAW	PECAN PIE	Tex-mex menu		restaurant_id_77
JALAPENO AND CHEDDAR CORNBREAD	GRILLED RACK OF PORK WITH SHERRY VINEGAR BBQ SAUCE	SWEET POTATO CHESS PIE	Tex-mex menu		restaurant_id_77
PICKLED GRAPES WITH JICAMA AND CELERY SEED	BLT BURGERS WITH BACON MAYONNAISE	GINGERBREAD WHOOPIE PIES WITH LEMON-MOLASSES SWIRLED FLUFFY FROSTING	Tex-mex menu		restaurant_id_77
TEXAS TOMATO TOAST WITH ROASTED GARLIC SPREAD AND HOMEMADE RICOTTA	FISH TACOS WITH CORN SALSA	"
CUBAN COFFEE CUPCAKES"	Tex-mex menu		restaurant_id_77
JALAPENO-CORNMEAL PANCAKES	LEFTOVER THANKSGIVING NACHOS	CHOCOLATE LAVA CAKES	Tex-mex menu		restaurant_id_78
CORN DOGS	CHILAQUILES BURGERS	MEXICAN PUMPKIN BREAD PUDDING GRAVES WITH BAKED CHURRO MUMMIES	Tex-mex menu		restaurant_id_78
PORK TAMALES	MEXICAN-STYLE PESTO WITH RICE OR WHOLE GRAIN PASTA	TAMAL DULCE	Tex-mex menu		restaurant_id_78
FIESTA TOMATO WEDGE SALAD	CORIANDER LIME GRILLED CHICKEN LEGS	WASHINGTON APPLE BITES	Tex-mex menu		restaurant_id_78
SPICY BLACK-EYED-PEA RELISH	SMOKED ITALIAN SAUSAGE HOAGIE 	POMEGRANATE-APPLE CRISP	Tex-mex menu		restaurant_id_79
WHOLE-GRAIN HERBED GARLIC BREAD	PUERTO SAGUA CUBAN SANDWICH 	CINNAMON PEACHES WITH SUGAR BISCUITS AND WHIPPED CREAM	Tex-mex menu		restaurant_id_79
MIXED TOMATO SALSA CROSTINI	PORK CARNITAS	MUDSLIDE PIE	Tex-mex menu		restaurant_id_79
STICKY SPICY SLOW-COOKED RIBS	CRUNCH-TOPPED MAC AND CHEESE	FUNNEL CAKES	Tex-mex menu		restaurant_id_79
MEXICAN STUFFED TOMATOES	PORK STEAKS WITH HOMEMADE BARBECUE SAUCE, TEXAS STYLE YUKON GOLD POTATO FRITES, AND GRILLED CHAYOTE	BOURBON PECAN PIE	Tex-mex menu		restaurant_id_80
GRILLED CORN WITH MAPLE AND CHIPOTLE	P. R. PERNIL	BUTTERMILK POUND CAKE	Tex-mex menu		restaurant_id_80
GRILLED YUCATAN CHICKEN SKEWERS	BEAN, CAULIFLOWER AND CHEESE BURRITOS		Tex-mex menu		restaurant_id_80
PICKLED RED ONIONS AND FRESNO CHILES 	TEX-MEX TOMATO SOUP AND GRILLED CHEESE		Tex-mex menu		restaurant_id_80
BEEF TACOS WITH MANGO-HOT PEPPER SALSA	BURGERS WITH GREEN TOMATO SALSA	MOLASSES-BOURBON PECAN PIE	Tex-mex menu		restaurant_id_81
BLACK BEAN, CORN AND TOMATO SALAD	MEXICAN LAYERED BEAN CASSEROLE	GIANT CINNAMON-CHEESE DANISH	Tex-mex menu		restaurant_id_81
NACHO DOG	POSOLE MEXICAN LASAGNA	FRUITCAKE POPS	Tex-mex menu		restaurant_id_81
NACHO SALAD	TEXAS BOWL OF RED	SNICKERDOODLE ICE CREAM SANDWICHES	Tex-mex menu		restaurant_id_81
GUACAMOLE DEVILED EGGS	CHICKEN IN RED SESAME SEED SAUCE: PIPIAN ROJO DEL NORTE 	COOKIE-RIFIC ICE CREAM FREEZE	Tex-mex menu		restaurant_id_82
JALAPENO POPPER ORZO MAC-N-CHEESE	CAULIFLOWER-CHORIZO BURRITOS	BANANA SPLIT ICE CREAM CAKE	Tex-mex menu		restaurant_id_82
MASA CORN CAKES WITH POACHED EGGS	POACHED EGGS IN MOLE WITH CREAMY GREEN RICE	APPLE-BERRY BROWN BETTY	Tex-mex menu		restaurant_id_82
GRILLED SHRIMP SKEWERS WITH FENNEL CHOPPED SALAD	TEX-MEX STEW	APPLE-BERRY PIE POPS	Tex-mex menu		restaurant_id_82
MINI CHICKEN POTPIES	LIGHT CHICKEN ENCHILADAS	MEXICAN CHOCOLATE SUNDAE	Tex-mex menu		restaurant_id_83
TORTILLA-CHIPOTLE SOUP	MEXICAN BLTS WITH SPICY SALSA	CHOCOLATE AND VANILLA SUNDAES	Tex-mex menu		restaurant_id_83
RAJAS SALSA 	FISH TACOS WITH HABANERO SALSA	SOPAIPILLAS AND SHERRIED FRUIT COMPOTE ON HONEY PASTRY CREAM WITH VINAGRES DE YEMA GRAN RESERVA GLAZE	Tex-mex menu		restaurant_id_83
MEXICAN RED RICE	ANCHO-RUBBED TURKEY	SOPAPILLAS	Tex-mex menu		restaurant_id_83
GRILLED GUACAMOLE	GRILLED RIB EYE WITH TOMATO AND POBLANO CHILE SAUCE	VIXXXEN: RED HOT VELVET CUPCAKES WITH FIERY CINNAMON CREAM CHEESE FROSTING	Tex-mex menu		restaurant_id_83
NACHOS	ROASTED CHICKEN WITH PUMPKIN SEED SALSA	GEORGE CARAMELIN: CHOCOLATE CINNAMON CUPCAKES WITH VANILLA BEAN BOURBON FROSTING, BOURBON CARAMEL SAUCE, AND CANDIED PECANS	Tex-mex menu		restaurant_id_84
PRAIRIE SUSHI	CHA CHA BOWL	RUM-ROASTED PINEAPPLE AND SUGARED PECANS WITH VANILLA BEAN ICE CREAM	Tex-mex menu		restaurant_id_84
TAMALES	CHICKEN CHILAQUILES WITH FRIED EGGS	HOMEMADE MANGO-AGAVE GRANOLA WITH GREEK YOGURT	Tex-mex menu		restaurant_id_84
NEW YORK STRIP STEAKS	EASY CHICKEN BURRITOS WITH MOJO	SWEET AND SPICED PECANS	Tex-mex menu		restaurant_id_84
QUESO FUNDIDO WITH CHORIZO 	SKIRT STEAK TACOS WITH ROASTED TOMATO SALSA	BASIL-MINT COCONUT CREAM PIE	Tex-mex menu		restaurant_id_84
CHILE RELLENO	TEXAS STYLE BACON, BEANS AND EGGS: BLACK BEAN CHILAQUILES 	BIZCOCHITOS	Tex-mex menu		restaurant_id_85
BUFFALO STEAKS WITH PICKLED CORN SALAD AND HOTTISH SAUCE	VEGETARIAN CHILI	CHOCOLATE CROWN POUND CAKE	Tex-mex menu		restaurant_id_85
MEXICAN FOUR CHEESE POTATOES AU GRATIN 	HUEVOS RANCHEROS DIVORCED-STYLE (HUEVOS RANCHEROS DIVORCIADOS)	SOPAIPILLAS WITH CHOCOLATE SAUCE	Tex-mex menu		restaurant_id_85
ROASTED CORN WITH CHILE: ELOTES ASADOS CON CHILE	GNOCCHI CON POLPETTE DI MANZO	CHOCOFLAN	Tex-mex menu		restaurant_id_85
FRIED SHRIMP PO-BOYS	BROOKLYN CHILI BURGERS WITH SMOKY BARBECUE SAUCE WITH OIL AND VINEGAR SLAW	HORCHATA RICE PUDDING	Tex-mex menu		restaurant_id_85
CAESAR SALAD WITH BACON, BRUSSELS SPROUTS AND BASIL	GREEN CHILI SLOPPY JOSES WITH REFRIED BEAN DIP AND CHIPS	STUFFED MEXICAN HOT CHOCOLATE FRENCH TOAST WITH CINNAMON WHIPPED CREAM AND CHOCOLATE-MAPLE GANACHE	Tex-mex menu		restaurant_id_85
BLACK BEAN AVOCADO SALSA WITH CORN	STEWED CHICKEN, REFRIED BEANS AND OAXACA CHEESE QUESADILLAS	SOPAPILLAS	Tex-mex menu		restaurant_id_85
SUPER NACHOS	CHEESY SCRAMBLED EGG FAJITAS	MONSTER MARSHMALLOW COOKIES	Tex-mex menu		restaurant_id_85
GRILLED SWEET POTATOES WITH LIME CILANTRO VINAIGRETTE	LAMB KABOBS	MEXICAN RHUBARB CHOCOLATE CHUNK BROWNIES	Tex-mex menu		restaurant_id_85
MEXICAN CHORIZO MEATBALL SOUP	STEAK TACOS WITH TOMATILLO SALSA	STRAWBERRY MARGARITA PANCAKES	Tex-mex menu		restaurant_id_85
TEQUILA CHORIZO CLAMS ON THE GRILL	BLACK BEAN, CORN AND TURKEY CHILI	HOT PEACHES AND CREAM	Tex-mex menu		restaurant_id_86
FARRO AND CORN SALAD	CHIPOTLE CASHEW CHICKEN WITH BROWN RICE	STUFFED MEXICAN HOT CHOCOLATE FRENCH TOAST WITH CINNAMON WHIPPED CREAM AND CHOCOLATE-MAPLE GANACHE	Tex-mex menu		restaurant_id_86
SWEET CORN SUCCOTASH	CUMIN BEEF PEPPER STEAK AND BROWN RICE 	SPICY CITRUS POPCORN	Tex-mex menu		restaurant_id_86
SIMPLE TACO SALAD	GRILLED TEQUILA GARLIC LIME FLANK STEAK		Tex-mex menu		restaurant_id_86
CITRUS SLAW	TORTILLA FRIED QUESO CATFISH		Tex-mex menu		restaurant_id_86
CORN AND AVOCADO SALAD	ULTIMATE CHICKEN QUESADILLA		Tex-mex menu		restaurant_id_87
POBLANO STUFFED CORNBREAD	TURKEY CHIPOTLE CHILI WITH PEPPER JACK CHEESE CORN CAKE TOPPERS		Tex-mex menu		restaurant_id_87
"ROASTED BUTTERNUT SQUASH AND SAGE SPREAD
"	CHIPOTLE RUBBED STEAK TACOS MOLE WITH CHIPOTLE CREAM AND GUACAMOLE		Tex-mex menu		restaurant_id_87
GRILLED CORN AND BEAN SALSA WITH BAKED CORN CHIPS	PULLED CHICKEN EMPANADAS		Tex-mex menu		restaurant_id_87
MEXICAN RED RICE (ARROZ ROJO)	BLACK BEAN AND BEEF CHILAQUILES WITH FRIED EGGS		Tex-mex menu		restaurant_id_87
PIMENTO CHEESE SPREAD WITH CRUSTY BREAD	CHICKEN ENCHILADA SKILLET		Tex-mex menu		restaurant_id_88
CHEESY STUFFED TACO MEATBALLS	CREAM OF ROASTED RED BELL PEPPER SOUP WITH ROASTED SWEET CORN AND CILANTRO- LIME SOUR CREAM		Tex-mex menu		restaurant_id_88
PAPAYA-CILANTRO SALSA	BEEF TOSTADAS		Tex-mex menu		restaurant_id_88
CHUNKY GUACAMOLE WITH SERRANO PEPPERS	CHORIZO QUESADILLAS		Tex-mex menu		restaurant_id_88
FRIED DILL PICKLES	PUERCO ENCHILADO TACOS		Tex-mex menu		restaurant_id_88
CHAYOTE SLAW WITH CUMIN AND LIME	FIESTA LIME TACOS		Tex-mex menu		restaurant_id_89
CORN PUDDING	CHIPOTLE BEEF TOSTADAS		Tex-mex menu		restaurant_id_89
COLLARD AND MUSTARD GREENS	VEGETARIAN ENCHILADAS		Tex-mex menu		restaurant_id_89
COWBOY STROMBOLI	PITTSBURGH CHEESE STEAK		Tex-mex menu		restaurant_id_89
JICAMA-ORANGE SALAD	CHICKEN, CHILI, AND CHEESE QUESADILLAS		Tex-mex menu		restaurant_id_89
JICAMA, CARROT ORANGE-CHIPOTLE SLAW	ONE PAN TILAPIA FISH TACOS WITH 5 MINUTE MOLE		Tex-mex menu		restaurant_id_90
CRISPY ZUCCHINI FRIES WITH BUTTERMILK RANCH DIPPING SAUCE	MEXICAN FISH STEW		Tex-mex menu		restaurant_id_90
FRIED PICKLES WITH CAJUN AIOLI	BREAKFAST TACOS WITH CHORIZO, EGG AND POTATO		Tex-mex menu		restaurant_id_90
GUACAMOLE WITH CRISPY CHIPS	SOPA SECA: MEXICAN NOODLE CASSEROLE		Tex-mex menu		restaurant_id_90
PICKLED PINEAPPLE SALSA	OAXACA BURGER WITH MANCHEGO, AVOCADO AND PICKLED HABANERO ONIONS		Tex-mex menu		restaurant_id_90
BUFFALO STEAKS WITH PICKLED CORN SALAD AND HOTTISH SAUCE	BEEF AND BLACK BEAN CHILI WITH TOASTED CUMIN CREMA AND AVOCADO RELISH		Tex-mex menu		restaurant_id_91
VEGETARIAN CHILI VERDE	LATIN BURGERS WITH CARAMELIZED ONION AND JALAPENO RELISH AND RED PEPPER MAYONNAISE		Tex-mex menu		restaurant_id_91
FIERY 5 PEPPER SHRIMP AND WATERMELON KABOBS	GRILLED MARINATED LEG OF LAMB WITH ASPARAGUS AND MINT CHIMICHURRI		Tex-mex menu		restaurant_id_91
DRUNKEN CITRUS SALAD	ENCHILADAS COLORADO		Tex-mex menu		restaurant_id_91
MAC AND CHEESE	TEQUILA CITRUS CHICKEN		Tex-mex menu		restaurant_id_91
JICAMA, CARROT ORANGE-CHIPOTLE SLAW			Tex-mex menu		restaurant_id_92
BROCCOLI AND ALMOND SALAD			Tex-mex menu		restaurant_id_92
CREAMY CHICKEN TORTILLA SOUP			Tex-mex menu		restaurant_id_92
CHICKPEA FLATBREAD WITH PARSLEY-OLIVE SALAD	NORTH AFRICAN SPICED ALASKA HALIBUT	Olive Oil Honey Cake	North African menu		restaurant_id_92
FLATBREAD WITH CHARRED BROCCOLI AND ROASTED GRAPES	MOROCCAN HARISSA ROAST CAULIFLOWER	BAKLAVA	North African menu		restaurant_id_92
QUINOA SALAD WITH APRICOTS, BASIL AND PISTACHIOS	MOROCCAN HARISSA ROAST CAULIFLOWER	FRUIT SALAD WITH ORANGE-VANILLA SYRUP	North African menu		restaurant_id_92
FRIED COUSCOUS SALAD	MOROCCAN COUSCOUS	BLUEBERRIES FOSTER	North African menu		restaurant_id_92
ROUND 2 RECIPE - PITA PILE ON WITH SPICY YOGURT SAUCE	MOROCCAN CHICKEN AND SQUASH	NO-BAKE SUMMER PIE MINIS	North African menu		restaurant_id_92
CHICKEN TARRAGON SALAD	WOOD-ROASTED STRIPED BASS WITH MEYER LEMON AND OLIVE RELISH	ICE CREAM STUFFED ORANGES WITH CARAMEL SAUCE	North African menu		restaurant_id_92
	MAPLE-AND-BALSAMIC-GLAZED LAMB CHOPS WITH MINT, TOASTED ALMONDS AND FETA COUSCOUS		North African menu		restaurant_id_92
MOROCCAN PEANUT COUSCOUS WITH PEAS	SLOW-COOKER MOROCCAN TURKEY MEATBALLS	LOVE CAKE	North African menu		restaurant_id_93
HOMEMADE FLAT BREAD	SLOW-COOKER MOROCCAN TURKEY MEATBALLS		North African menu		restaurant_id_93
MIDDLE-EASTERN EGGPLANT ROUNDS	GOLDEN LEMON-OLIVE CHICKEN WITH PINE NUT COUSCOUS	SAFFRON CREAM SCONES	North African menu		restaurant_id_94
CURRIED COUSCOUS SALAD	MOROCCAN MEATBALLS WITH EGGS		North African menu		restaurant_id_94
COUSCOUS WITH CURRANTS, ALMONDS, AND PARSLEY	MOROCCAN MEATBALLS WITH EGGS		North African menu		restaurant_id_95
MIDDLE EASTERN SPICED POTATO CAKES	RICOTTA AND CINNAMON MEATBALLS		North African menu		restaurant_id_95
PEARL COUSCOUS SALAD WITH SMOKED PAPRIKA	LAMB CHOPS ON SPICED TOMATOES AND ONIONS		North African menu		restaurant_id_96
SAFFRON ROASTED CAULIFLOWER	MOROCCAN FLANK STEAK		North African menu		restaurant_id_96
SUMAC COUSCOUS SALAD WITH DUNGENESS CRAB AND CALIFORNIA AVOCADO 	PAN-FRIED LAMB CHOPS WITH HARISSA 		North African menu		restaurant_id_97
PAPAYA AND FETA SALAD	CURRIED RICE WITH SMOKED TROUT		North African menu		restaurant_id_97
PEARL COUSCOUS WITH CELERY, SCALLIONS AND CRANBERRIES	CHICKEN TAGINE WITH GREEN OLIVES AND PRESERVED LEMON		North African menu		restaurant_id_98
	SPICE CHICKEN		North African menu		restaurant_id_98
	LEMON CHICKEN		North African menu		restaurant_id_99
HOISIN CHICKEN WITH CUCUMBER SALAD	SPICY CAULIFLOWER STIR-FRY	COCONUT DREAM DESSERT	East Asian Menu		restaurant_id_99
HOT-AND-SOUR SEAFOOD SOUP	PEANUT NOODLES WITH PORK	CRISPY WARM SESAME MOCHI WITH XO CARAMEL	East Asian Menu		restaurant_id_99
STEAMED DUMPLING SPOONS WITH SPECIAL SAUCE	SWEET AND SOUR CHICKEN	PAT BING SOO (KOREAN SHAVED ICE)	East Asian Menu		restaurant_id_99
AHI TUNA WITH NAPA CABBAGE SALAD	SWEET SOY-GLAZED CHICKEN	LOOPY LIME AND LYCHEE GELATIN PARFAIT	East Asian Menu		restaurant_id_99
NAKED SPRING ROLLS	SAUTEED WILD MUSHROOMS WITH SPINACH	HAUPIA WITH PINEAPPLE	East Asian Menu		restaurant_id_99
PEANUT-CHICKEN NOODLE SALAD 	TAILGATING ASIAN WINGS	MIAMI HEAT	East Asian Menu		restaurant_id_99
CHICKEN MEATBALL DIM SUM	COCONUT SHRIMP WITH TROPICAL RICE	COCONUT CHOCOLATE TARTS	East Asian Menu		restaurant_id_100
COCONUT-WATERMELON SALAD	THAI FISH CURRY	BANANA SPLITS WITH PINEAPPLE BROWN SUGAR TOPPING	East Asian Menu		restaurant_id_100
KABOCHA SQUASH AND SHIITAKE WONTONS WITH POMEGRANATE-VINEGAR SYRUP	SPICY THAI NOODLES WITH GINGER PEANUT DRESSING	PUFF PASTRY SNOWFLAKES	East Asian Menu		restaurant_id_101
SEARED SCALLOPS WITH DRAGON FRUIT SALSA	ORANGE-ANISE GLAZED DUCK	FRUIT WANDS	East Asian Menu		restaurant_id_101
ASIAN GLAZED WINGS	ASIAN MARINATED PORK CHOPS	YO HALLA ON THE SQUARE	East Asian Menu		restaurant_id_102
KOREAN GRILLED CHICKEN	WHOLE-GRAIN MUSHROOM AND KIMCHI BROWN RICE	GRILLED MANGO WITH LIME, SALT AND ANCHO POWDER	East Asian Menu		restaurant_id_102
SWEET CHILI CHIP-CRUSTED CHICKEN FINGERS WITH SRIRACHA RANCH DIPPING SAUCE	ASIAN PORK MEATBALLS	SWEET COCONUT RICE WITH CANDIED GINGER	East Asian Menu		restaurant_id_103
CRISPY CHICKEN WITH SPICY PEAR CRANBERRY SAUCE	ORANGE CHILE NOODLES	CHURROS WITH COCONUT SAUCE	East Asian Menu		restaurant_id_103
SCALLION AND EGG PANCAKES	GRILLED SHIITAKE AND TOFU BANH MI	RICE FRITTERS WITH SESAME CARAMEL	East Asian Menu		restaurant_id_104
ASIAN CHICKEN SALAD WITH CELLOPHANE NOODLES	SESAME AND PEANUT NOODLES	KONA MANGO CREAM PIE	East Asian Menu		restaurant_id_104
PICKLED BROCCOLI STEMS	PAD FRY	LIME, GINGER AND MASCARPONE CAKE	East Asian Menu		restaurant_id_105
BAKED SPRING ROLLS WITH CRAB	ASIAN NOODLES WITH SHRIMP AND EDAMAME	RASPBERRY LIME TERRINE	East Asian Menu		restaurant_id_105
TRADITIONAL MANDARIN FRIED RICE	SPICY CHICKEN STIR-FRY	PASSION FRUIT MOUSSE	East Asian Menu		restaurant_id_106
ASIAN EGG DROP SOUP	GINGER BEEF AND NOODLE BOWLS	MELON BOWLS WITH FRUIT SORBET	East Asian Menu		restaurant_id_106
LIGHTER ASIAN NOODLE SALAD	ASIAN CHICKEN BURGER WITH SPICY LEMONGRASS MAYO AND PICKLED ASIAN SLAW	CHOCOLATE ANISE COOKIES	East Asian Menu		restaurant_id_107
ASIAN-SPICED BABY BACK RIBS	GRILLED EGGPLANT TERIYAKI	TROPICAL VANILLA PUDDING SHOTS	East Asian Menu		restaurant_id_107
GRILLED THAI BEEF SALAD	BEEF AND MUSHROOM STIR-FRY	HUNGRY GRILLED PINEAPPLE WITH SO-GOOD CINNAMON-VANILLA YOGURT DIP	East Asian Menu		restaurant_id_107
SCALLION PANCAKES 	THAI FISH CURRY	CHOCOLATE BAO	East Asian Menu		restaurant_id_108
HEALTHY AND FLAVOR-FILLED SOBA SALAD 	SLOW COOKER SWEET AND SOUR PORK	WARM FRUIT COMPOTE OF CHERRIES, ORANGE AND CRANBERRIES OVER VANILLA ICE CREAM	East Asian Menu		restaurant_id_108
CAPRESE SALAD WITH ROASTED MANGO DRESSING	STIR-FRY IN A BUN	CARAMELIZED PINEAPPLE AND CREME CARAMEL WITH BANANA ICE CREAM	East Asian Menu		restaurant_id_108
WHITE MISO MUSSELS WITH WATERCRESS	TURKEY PAD THAI	CHOCOLATE-COCONUT PRETZELS	East Asian Menu		restaurant_id_109
HERBED RICE	ASIAN FRIED CHICKEN AND PHO SLAW	GRILLED BANANA SPLIT SUNDAE WITH BITTERSWEET CHOCOLATE SAUCE	East Asian Menu		restaurant_id_109
PORK SATAY	COCONUT BASIL CHICKEN BURGERS WITH THAI PEANUT PESTO	COCONUT CAKE	East Asian Menu		restaurant_id_109
SESAME GRILLED ASPARAGUS	TANTALIZING THAI NUTTY CHICKEN	GRILLED SPICED SUGAR BANANAS	East Asian Menu		restaurant_id_110
WARM SESAME SLAW SALAD	KUNG PO CHICKEN	COCONUT RUM AND LIME CUPCAKES	East Asian Menu		restaurant_id_110
ASIAN CHICKEN NOODLE SOUP	PHO TO GO	COCONUT-RICE COOLER: HORCHATA DE COCO	East Asian Menu		restaurant_id_110
QUINOA WITH SHIITAKES AND SNOW PEAS	CHICKEN RAMEN STIR-FRY	HOT RASAPPLE-RUM CIDER	East Asian Menu		restaurant_id_111
TERIYAKI GINGER TUNA SKEWERS	ASIAN PORK WITH NOODLES	RUM-RAISIN RICE PUDDING	East Asian Menu		restaurant_id_111
GRILLED CORN AND TOMATO SALAD WITH THAI BASIL VINAIGRETTE DRESSING	MISO GLAZED SALMON		East Asian Menu		restaurant_id_111
MANGO-CUCUMBER RICE SALAD	OPEN-FACE VIETNAMESE CHICKEN SANDWICHES 		East Asian Menu		restaurant_id_111
STIR-FRY CABBAGE	ASIAN-MARINATED PORK LOIN WITH GINGERED SWEET POTATOES AND FIVE-SPICE APPLES	PUERTO RICAN COCONUT MILK-RUM CHRISTMAS DRINK: COQUITO	East Asian Menu		restaurant_id_112
TERIYAKI KABOBS	SESAME SOBA NOODLES	FROZEN YOGURT WITH POACHED RUM RAISIN PEARS	East Asian Menu		restaurant_id_112
SPICY COCONUT SHRIMP	LETTUCE CUPS WITH TOFU AND BEEF	BANANAS FLAMBE	East Asian Menu		restaurant_id_112
TUNA CARPACCIO WITH ROASTED BABY BEETS AND CITRUS PRESSED OLIVE OIL	CHICKEN LETTUCE WRAPS		East Asian Menu		restaurant_id_112
SUPER 5 STAR ROLL WITH SHUT UP SAUCE	MAIN CHALLENGE: RED CHILI CITRUS MUSHROOMS WITH GRILLED ZUCCHINI	ABSOLUTE PERFECTION	East Asian Menu		restaurant_id_113
ASIAN HOT-SWEET PICKLE SALAD 	THAI RIBS AND LEGS	VANILLA PINEAPPLE COMPOTE	East Asian Menu		restaurant_id_113
BABY EGG ROLLS WITH SOY SESAME DIPPING SAUCE	PEANUT COATED CHICKEN THIGH TENDERS WITH CURRY COCONUT SAUCE		East Asian Menu		restaurant_id_113
THAI-STYLE GRILLED VEGETABLES	ASIAN CHICKEN WRAP WITH CHILI SAUCE AND CARAMEL CORN		East Asian Menu		restaurant_id_113
STUFFED CABBAGE	INDONESIAN GINGER CHICKEN		East Asian Menu		restaurant_id_114
CHICKEN WINGS IN PEANUT SAUCE	SEARED AHI TUNA TACO WITH ASIAN SLAW AND PLUM SAUCE		East Asian Menu		restaurant_id_114
HAEMUL PAJEON (KOREAN SEAFOOD PANCAKE) 	HONG KONG STYLE NOODLES WITH CHICKEN AND VEGETABLES		East Asian Menu		restaurant_id_114
SIMPLE SEOUL BIBIMBAP	GRILLED MAHI MAHI FILLETS AND ASPARAGUS WITH ORANGE AND SESAME 		East Asian Menu		restaurant_id_114
THAI CHICKEN SALAD WITH PEANUTS AND LIME	50/50 OLIVE OIL/COCONUT OIL BLEND HEALTHY CHICKEN STIR FRY		East Asian Menu		restaurant_id_115
SWEET AND SPICY SLAW	ONLINE ROUND 2 RECIPE - JAPANESE NOODLE BOWL		East Asian Menu		restaurant_id_115
HONEY-TERIYAKI CHICKEN FINGERS WITH SESAME SEEDS WITH SESAME CELLOPHANE NOODLES AND SNAP PEAS	CHICKEN SALAD WITH PEANUT-LIME VINAIGRETTE		East Asian Menu		restaurant_id_115
HONEY HOISIN GLAZED WINGS	SPICY TURKEY LETTUCE CUPS		East Asian Menu		restaurant_id_115
SEARED SCALLOPS, POLENTA, DEMI-GLACE	SHRIMP EGG FOO YOUNG		East Asian Menu		restaurant_id_116
TOGARASHI ONION RINGS WITH WASABI DIPPING SAUCE	30-MINUTE PAN-SEARED SALMON WITH BABY BOK CHOY AND SHIITAKE MUSHROOMS		East Asian Menu		restaurant_id_116
COLD CUCUMBER SALAD	BULGOGI-STYLE STEAK WITH KIMCHI SLAW AND TEMPURA FRIES		East Asian Menu		restaurant_id_116
COCONUT CHICKEN LOLLIPOPS WITH TROPICAL KETCHUP AND ANAHEIM CHILE SAUCE	ULTIMATE KOREAN FRIED CHICKEN		East Asian Menu		restaurant_id_116
THAI BEEF SKEWERS WITH PICKLED CUCUMBERS	SWEET RED CHILI CHICKEN SATAY		East Asian Menu		restaurant_id_117
CUCUMBER SOUP WITH WASABI-AVOCADO CREAM	SWEET AND SOUR PINEAPPLE PORK		East Asian Menu		restaurant_id_117
SHRIMP AND VEGETABLE TEMPURA	MUSHROOM TERIYAKI NOODLES		East Asian Menu		restaurant_id_117
CRISPY SOY ROASTED KALE CHIPS	SHRIMP LO MEIN		East Asian Menu		restaurant_id_117
JAPANESE-STYLE CRISPY PORK	STEAK SALAD WITH PEANUT-LIME VINAIGRETTE		East Asian Menu		restaurant_id_118
TERIYAKI CHICKEN WITH PICKLED CUCUMBERS	ANTS IN A TREE		East Asian Menu		restaurant_id_118
PORK AND SHRIMP GYOZA	CHINESE NOODLE-VEGETABLE BOWL		East Asian Menu		restaurant_id_118
STICKY HONEY-SOY CHICKEN WINGS	SPICED PORK AND CABBAGE		East Asian Menu		restaurant_id_118
SWEET AND STICKY PORK RIBS	SZECHWAN PEPPER-CRUSTED STEAK SMOTHERED WITH ONIONS		East Asian Menu		restaurant_id_119
STEAMED ASIAN GREENS WITH HONEY SOY SESAME DRESSING	TERIYAKI CHICKEN RICE BOWL		East Asian Menu		restaurant_id_119
SESAME TURKEY SALAD	EMERALD STIR-FRY WITH BEEF		East Asian Menu		restaurant_id_119
	SESAME RED CURRY CHICKEN WITH BOK CHOY AND SWEET COCONUT RICE		East Asian Menu		restaurant_id_119
SESAME STIR-FRIED CHINESE GREENS	THAI-STYLE BASIL SHRIMP WITH BASIL-COCONUT RICE		East Asian Menu		restaurant_id_120
	PEANUT SMOKED PORK LOIN WITH PEANUT BUTTER BBQ SAUCE AND CARROT AND PICKLED ONION SALAD		East Asian Menu		restaurant_id_120
CRUNCHY ASIAN CHICKEN SALAD	SESAME SHRIMP FRIED RICE WITH CABBAGE		East Asian Menu		restaurant_id_120
